{
  "@context": [
    "https://www.w3.org/ns/credentials/v2"
  ],
  "id": "https://example.org/credentials/vc-001",
  "type": ["VerifiableCredential", "DataspaceParticipantCredential"],
  "issuer": {
    "id": "did:web:trust.example.org",
    "name": "Example Trust Anchor"
  },
  "validFrom": "2026-01-01T00:00:00Z",
  "validUntil": "2027-01-01T00:00:00Z",
  "credentialSubject": {
    "id": "did:web:participant.example.org",
    "participantId": "BPNL000000000001",
    "membershipStatus": "active"
  },
  "credentialStatus": {
    "id": "https://trust.example.org/status/list/1#42",
    "type": "BitstringStatusListEntry",
    "statusPurpose": "revocation",
    "statusListIndex": "42",
    "statusListCredential": "https://trust.example.org/status/list/1"
  },
  "proof": {
    "type": "DataIntegrityProof",
    "cryptosuite": "eddsa-rdfc-2022",
    "proofPurpose": "assertionMethod",
    "verificationMethod": "did:web:trust.example.org#key-1",
    "created": "2026-01-01T00:00:00Z",
    "proofValue": "z3MvGcVxzurc4qv5xtansasdHJK2dLtPmb4ND9rQ3mpvCPqzX4Eu0LmNLAWVhFpH5CsE4opqRdm"
  }
}
